{
  "schemaVersion": 1,
  "id": "current-contract-only",
  "type": "breaking",
  "summary": "Support one current process-owned contract definition at version 1",
  "source": "https://github.com/phuongnse/engineering-process/issues/199",
  "details": {
    "problem": "The process carried multiple schema generations, version branches, legacy readers and writers, migration cleanup, and pre-1.0 publication adapters after active consumers had adopted current releases.",
    "changes": "Make the latest process-owned definitions the single version-1 contracts, reject other versions, remove obsolete compatibility paths, and preserve current correctness, lifecycle, evidence, adoption, publication, and distribution guarantees.",
    "affectedPaths": [
      "engineering_process",
      "schemas",
      "process_assets/skills",
      "tests",
      "verification"
    ],
    "apply": "Adopt the released package and exact hash, update current consumer configuration and integration references, regenerate managed artifacts, recreate active process artifacts, and rerun required profiles.",
    "compatibility": "Breaking process-contract change. The process does not read or convert another release's process-owned artifacts; consumer product compatibility remains consumer-owned.",
    "notes": "Package/release identity, pin/hash, snapshot binding, evidence freshness, independent review, rollback, and adoption integrity remain unchanged. Historical releases and evidence are not rewritten."
  }
}
