{
  "schemaVersion": 1,
  "id": "adoption-upgrade-compatibility",
  "type": "fix",
  "summary": "Allow hash-locked consumers to adopt from an older process lock.",
  "source": "https://github.com/phuongnse/engineering-process/issues/248",
  "details": {
    "problem": "A Renovate upgrade could install a newer hash-locked engineering-process package and still fail before mutation because the consumer process.lock identified the previous release.",
    "changes": "Adoption now treats a schema-valid older engineering-process lock as migration input, converges it to the installed distribution, and continues to reject newer locks and current-version distribution mismatches.",
    "affectedPaths": [
      "engineering_process/adoption.py",
      "tests/test_adoption.py"
    ],
    "apply": "Adopt the patch release, regenerate the consumer's hash-locked process requirements through its existing workflow, and run the managed adoption command.",
    "compatibility": "Non-breaking for consumers upgrading from an older final process release; invalid, future, foreign, or current-version mismatched lock state remains rejected before mutation.",
    "notes": "The existing managed-path ownership, collision, snapshot, rollback, and replay boundaries remain authoritative."
  }
}
