{
  "schemaVersion": 1,
  "id": "resolve-process-issues",
  "type": "capability",
  "summary": "Resolve process issues #197-#205: durable feedback and review recovery, snapshot and test cost, guidance authority, PR evidence, adoption scope, CI repetition, and necessary verification.",
  "source": "https://github.com/phuongnse/engineering-process/issues/205"
}
