{
  "schemaVersion": 2,
  "id": "verification-suite-performance",
  "type": "fix",
  "summary": "Make the full verification suite deterministic and expose bounded timing diagnostics.",
  "source": "https://github.com/phuongnse/engineering-process/issues/201",
  "details": {
    "problem": "The repository-owned full verification suite took about six minutes on Windows and review-context tests incorrectly reported stale evidence when run after the complete suite, while local output did not identify the slowest tests.",
    "changes": "Give review-context tests an isolated fixture owner, seed their verified states once per test class, use the same bounded child environment as the verification boundary, and report aggregate, slow-test, fixture-setup, and profile timing without changing profile exit semantics or deleting behavioral coverage. Lifecycle fixtures clone an immutable Git snapshot instead of copying a live .git directory, avoiding races with Git maintenance locks.",
    "affectedPaths": [
      "tests/test_review_contexts.py",
      "tests/test_lifecycle.py",
      "verification/run_test_suite.py"
    ],
    "apply": "Run the normal development and review profiles; use the bounded suite timing and slow-test summary to diagnose future cost, and do not replace final verification with a focused subset.",
    "compatibility": "No breaking change. Existing profile commands, required checks, skip behavior, process/Git/filesystem boundaries, and stored evidence semantics remain supported.",
    "notes": "The reviewed change evidence records repeated comparable self-consumer measurements and the bounded improvement method; it does not establish a universal latency target. Shared mutable checkouts and blanket mocks remain out of scope."
  }
}
