{
  "schemaVersion": 2,
  "id": "structural-architecture-verification",
  "type": "fix",
  "summary": "Enforce structural architecture verification over keyword test assertions and generalize invariant guidance.",
  "source": "owned change #structural-architecture-verification",
  "details": {
    "problem": "Architecture tests verified runtime invariants by searching for specific variable and token names, approximating structural invariants with keyword string matching and failing to detect architectural deviations under different identifiers.",
    "changes": "Replace keyword-based token assertions in architecture tests with AST syntax boundary inspection, generalize the authoritative-structure invariant to require structural syntax or behavioral invariance, and mandate independent reviewers to reject keyword/identifier name assertions in tests.",
    "affectedPaths": [
      "process_assets/skills/change-review/SKILL.md",
      "process_assets/skills/production-engineering/SKILL.md",
      "process_assets/skills/production-engineering/invariants.json",
      "tests/test_architecture.py"
    ],
    "apply": "No action required; architecture tests and process guidance apply immediately.",
    "compatibility": "Non-breaking. Preserves test suite pass status while establishing structural AST verification.",
    "notes": "Ensures architectural verification tests invariant structural properties or behavioral invariance rather than local identifier presence."
  }
}
